{
  "ts": "2026-01-30T07:04:43+00:00",
  "host": "devbox",
  "repo": {
    "path": "/app",
    "sha_short": "296ee2b",
    "dirty": true
  },
  "compose": {
    "file": "infra/compose/compose.prod.yml",
    "file_sha256": "42313f168de8f197824ed11ff96b408fd7d35efb0ffbf5d2ea0914d28cc2d455",
    "config_sha256": "9c62683ae7d04fc3380f4b7381a7b1fd7bc3c5c3fe6c74ef2193211b1f4a1557",
    "render_degraded": false,
    "warnings": []
  },
  "containers": [],
  "volumes": [],
  "mounts": [],
  "health": {
    "mode": null,
    "url": null,
    "ok": null,
    "http_code": null,
    "reason": null
  }
}
